topic,video_id,title,description,views,likes,duration_minutes,keywords,keyword_count,difficulty,positive_comments(%),neutral_comments(%),negative_comments(%),total_comments,video_url,published_at,channel_title
computer networks,g2fT-g9PX9o,Network Ports Explained,"Networking Audio Book recommendation Amazon affiliate . Just get the book by signing up for a free 30 day trial of Amazon Audible Premium Plus. What is a port? What are port numbers? A port is a logical connection that is used by programs and services to exchange information. It specifically determines which program or service on a computer or server that is going to be used..whether that is pulling up a web page, using an FTP service, accessing email and so on. Watch my Netstat video here: Go t",2208857,67042,10.55,"port, networking, book, amazon, get, free, day, trial, numbers, used, information, service, netstat, ports, example, audio, recommendation, affiliate, signing, audible",20,"Based on the provided text, I'd classify this content as **Beginner** to **Low-Intermediate**. Here's why:

*   **Beginner Aspects:** The core concepts explained (what is a port, port numbers, basic examples) are fundamental to networking. The explanation is fairly straightforward.
*   **Slightly Beyond Basic:** The inclusion of `netstat` command and brief discussion of common port examples nudges it into a slightly more advanced territory than pure introductory material. Mentioning IP addresses vs ports also adds a layer of complexity beyond the most basic understanding.
*   **Overall Tone & Purpose:** The language and structure lean towards introducing these topics rather than delving deep. The focus on an audio book recommendation, Amazon affiliate links, and free trials indicates a broader audience appeal.

Therefore, it's best suited for someone just starting to learn about networking, but it touches on concepts that might be considered the very beginning of intermediate knowledge.",73.33,26.67,0.0,15,https://www.youtube.com/watch?v=g2fT-g9PX9o,2022-07-18T13:01:11Z,PowerCert Animated Videos
computer networks,q3Z3Qa1UNBA,Complete CN Computer Networks in one shot | Semester Exam | Hindi,"KnowledgeGate Website: For free notes on University exam s subjects, please check out our course: SEMESTER EXAM BUNDLE Please message us on WhatsApp: Contact Us: Call on: +91 8000121313 Telegram Updates: gate Whatsapp Updates: Email: contact@knowledgegate.in One Shot Complete Playlist for GATE CSE Exam : Our One Shot Semester Exam Videos: Operating System: OuOhjauw DBMS: Computer Network: Digital Electronics: 4reIc Computer Architecture: Data Structure: Algorithm: YSdyww Software Engineering: Th",2120378,29286,378.43,"chapter, layer, class, exam, data, addressing, computer, network, basics, header, routing, knowledgegate, please, check, semester, whatsapp, contact, updates, gate, one",20,Beginner,6.67,73.33,20.0,15,https://www.youtube.com/watch?v=q3Z3Qa1UNBA,2023-09-30T00:58:38Z,KnowledgeGATE by Sanchit Sir
computer networks,eHV1aOnu7oM,IP address network and host portion | subnet mask explained in simple terms | CCNA 200 301 |,"ccna ipaddress subnetmask tutorial online free subnetting training Master Cisco CCNA 200 301 with Industry expert Looking to deepen your skills in networking? Join my CCNA course: ""CCNA 200 301 v1.1 Complete course with simple approach."" On My personal webpage CCNA 200 301 63ea2b6ae4b090a146306bcf What's Inside: Network Fundamentals concepts Ethernet switching Technologies IPv4 and IPv6 addressing concepts IP routing and protocols IP services and protocols used in network Network Security concep",2115584,23976,3.78,"ccna, network, skills, course, concepts, cisco, networking, protocols, practice, step, enroll, ipaddress, subnetmask, tutorial, online, free, subnetting, training, master, industry",20,Beginner,53.33,40.0,6.67,15,https://www.youtube.com/watch?v=eHV1aOnu7oM,2020-12-01T07:39:45Z,NETWORKING WITH H
computer networks,4ZHUoIoKvro,model on computer topology,,2137344,33869,0.25,No keywords,0,"This is difficult to classify precisely without knowing the specifics of the model. However, here's a breakdown with some likely scenarios:

**Beginner:**

*   **Simple Visual Representations:** A basic diagram of common topologies like bus, star, ring, mesh, and tree, with brief explanations of their structure. Might be used for introductory networking concepts.
*   **Basic simulations with limited variables:** Models might allow changing a couple of variables (e.g., number of devices on a bus) and show the effects on basic performance.

**Intermediate:**

*   **Functional Simulation Models:** Simulating data transmission across different topologies, including collisions, routing, and basic error detection. You could analyze network latency and throughput under various conditions.
*   **Models using specific protocols:** Demonstrating how protocols like CSMA/CD work on different topologies.
*   **Simple Network Design Scenarios:** Laying out a basic network for a small office, choosing the most appropriate topology, and estimating bandwidth needs.
*   **Modeling with Visual Simulation Tools:** Using visual simulation software to create network topology diagrams and simulate basic traffic flows.

**Advanced:**

*   **Complex Performance Modeling:** Using mathematical models (e.g., queuing theory) to analyze network performance under heavy load, including factors like queuing delay, packet loss, and jitter.
*   **Software Defined Networking (SDN) Models:** Simulating SDN architectures and exploring how they can be used to control and optimize network topologies.
*   **Fault Tolerance and Redundancy Modeling:** Designing networks with redundant links and switches, and modeling the impact of component failures on network availability.
*   **Optimization Algorithms:** Developing or implementing algorithms to find the optimal network topology based on specific constraints (e.g., cost, performance, reliability).
*   **Security Modeling:** Simulating attacks on different network topologies and evaluating the effectiveness of security measures.

**In Summary:**

*   **Beginner:** Focuses on *understanding* the basic topologies.
*   **Intermediate:** Focuses on *simulating* and *analyzing* basic network behavior.
*   **Advanced:** Focuses on *optimizing* complex network performance and resilience.

Therefore, the classification of ""model on computer topology"" depends significantly on the depth, features, and the intended purpose of the model.

Without more information, it's best to **lean towards Intermediate** as a starting point. Most models will go beyond simple diagrams and incorporate some level of simulation or analysis.",0.0,0.0,0.0,0,https://www.youtube.com/watch?v=4ZHUoIoKvro,2022-07-05T04:42:06Z,About the knowledge
computer networks,BQ-mvylDUN0,net connect bluetooth | how to connect internet in computer | computer mein internet kaise chalayen,: how to connect internet in computer | computer mein internet kaise chalayen | Android mobile se computer mein internet kaise chalayen | Android phone se computer mein internet kaise chalayen | mobile ka internet computer mein kaise share Karen | how to share Android mobile internet in computer | how to connect internet in computer My Social Media Facebook My Social Media Facebook Instagram nd/ .....................................................................................................,2035692,0,0.88,"internet, computer, mein, kaise, chalayen, android, mobile, connect, share, social, media, facebook, phone, karen, instagram, business, collaboration, contact, gmail, thanks",20,"I would classify this as **Beginner/Intermediate**. Here's why:

*   **Beginner:** The core questions focus on fundamental tasks like:

    *   Connecting to Bluetooth
    *   Setting up internet on a computer (which suggests a basic level of technical knowledge).
    *   Sharing internet from an Android phone to a computer.

*   **Intermediate:** Some terms suggest a more complex understanding, such as:

    *   The understanding that internet from a mobile phone can be shared with a computer.

The inclusion of contact information for business and collaboration, and the mention of social media platforms like Facebook and Instagram, suggest that the individual may be exploring more advanced concepts related to digital marketing and online presence. However, the primary focus remains on basic connectivity, which is why I lean towards Beginner/Intermediate.",0.0,0.0,0.0,0,https://www.youtube.com/watch?v=BQ-mvylDUN0,2020-12-11T21:50:12Z,Spark24x7 official
computer networks,rurs7cdT5cc,Basic Networking Commands Part 1,Computer Networks: Basic Networking Commands Part 1 Topics discussed: 1 ping networking command. 2 ipconfig networking command. 3 tracert networking command. 4 nslookup networking command. Follow Neso Academy on Instagram: @nesoacademy Contribute: Memberships: Books: books Website Forum Facebook Twitter Music: Axol x Alex Skrindo You NCS Release ComputerNetworksByNeso ComputerNetwork NetworkingCommands,1919564,33840,14.18,"networking, command, books, computer, networks, basic, commands, part, topics, discussed, ping, ipconfig, tracert, nslookup, follow, neso, academy, instagram, nesoacademy, contribute",20,Beginner,66.67,26.67,6.67,15,https://www.youtube.com/watch?v=rurs7cdT5cc,2019-12-10T13:45:01Z,Neso Academy
computer networks,GfaHdjApnhU,Lec 3: TCP/IP Protocol Suite | Internet Protocol Suite | OSI vs TCP/IP,"Subscribe to our new channel: In this video, TCP/IP Protocol Suite is discussed. It is also known as the Internet Protocol Suite. TCP/IP stands for Transmission Control Protocol/Internet Protocol. It is a set of networking protocols that form the foundation of modern Internet communication. TCP/IP is a communications protocol in a private computer network an intranet or extranet . Computer Networks Complete Playlist : 2joCpWOLUrDLvVV Other subject wise playlist Links: Design and Analysis of algo",1881040,45399,6.77,"protocol, follow, subscribe, computer, system, new, channel, suite, internet, playlist, links, design, theory, query, data, instagram, video, discussed, also, known",20,"Based on the description provided, I'd classify this as **Beginner** to **Low Intermediate**. Here's why:

*   **Focus on Fundamentals:** The video title and description clearly state the topic is the TCP/IP protocol suite and the OSI model, fundamental concepts in networking. The explanation of what TCP/IP stands for and its role in internet communication points to an introductory level.
*   **Broad Overview:** The context suggests a high-level overview rather than an in-depth exploration of specific protocols or advanced techniques.
*   **Reference to Playlist:** The references to other beginner topics such as C programming, Data Structures, and Discrete Mathematics indicate that the channel probably targets students and other beginners in Computer Science.
*   **Comparison of OSI and TCP/IP models:** Comparing the OSI and TCP/IP models is a very common topic in any basic networking course.

While a deeper understanding of these protocols is crucial for advanced networking topics, the initial introduction is typically considered beginner/early intermediate level.",26.67,73.33,0.0,15,https://www.youtube.com/watch?v=GfaHdjApnhU,2021-01-23T07:43:46Z,Gate Smashers
computer networks,f0Ad_4haEMg,Not connected no connections are available windows 7 laptop,"In this video, I will show you how to fix Windows 7 WiFi. 1. Right click on the network icon and click on Troubleshoot Problem. If you have a software problem with your network, it will be fixed automatically. 2. Go to the computer control panel. If your WiFi wireless device is disabled here, Right click and enable it. 3. If your wifi doesn't work properly even after following the number one and number two methods, then take a good look at the number three method. Each laptop has a WiFi button. ",1851076,16729,2.37,"wifi, click, number, facebook, video, right, network, problem, computer, button, show, fix, windows, icon, troubleshoot, software, fixed, automatically, control, panel",20,Intermediate,33.33,66.67,0.0,15,https://www.youtube.com/watch?v=f0Ad_4haEMg,2021-08-06T08:55:45Z,IT Magics
computer networks,cyXkeiwnALQ,Can't Connect to this network. wifi windows10 network,"Can't Connect to this network. wifi network technical For the Detail video, watch here. Subscribe for more videos.",2052828,53995,0.83,"network, connect, wifi, technical, detail, video, watch, subscribe, videos",9,Intermediate,46.67,53.33,0.0,15,https://www.youtube.com/watch?v=cyXkeiwnALQ,2023-05-16T06:43:25Z,Tech vek
computer networks,5Q-Yv6_0Qcw,Lec 29: Cyclic Redundancy Check CRC for Error Detection and Correction | Computer Networks,Subscribe to our new channel: Cyclic Redundancy Check CRC is an error detection technique widely used in data communication and storage systems. It is a more sophisticated method than single bit parity and provides better error detection capabilities. Computer Networks Complete Playlist : 2joCpWOLUrDLvVV Other subject wise playlist Links: Design and Analysis of algorithms DAA : Database Management System: Theory of Computation 76adtyb4ef7i Artificial Intelligence: nwb0HR5US5GFKFI Computer Archit,1809603,34654,12.7,"follow, subscribe, data, system, new, channel, crc, error, detection, computer, playlist, links, design, theory, query, instagram, cyclic, redundancy, check, technique",20,Advanced,46.67,53.33,0.0,15,https://www.youtube.com/watch?v=5Q-Yv6_0Qcw,2018-12-01T06:52:45Z,Gate Smashers
computer networks,3QhU9jd03a0,Computer Networks: Crash Course Computer Science 28,"Today we start a three episode arc on the rise of a global telecommunications network that changed the world forever. We re going to begin with computer networks, and how they grew from small groups of connected computers on LAN networks to eventually larger worldwide networks like the ARPANET and even the Internet we know today. We'll also discuss how many technologies like Ethernet, MAC addresses, IP Addresses, packet switching, network switches, and TCP/IP were implemented to new problems as ",1630423,29578,12.33,"networks, internet, crash, course, today, network, world, computer, connected, computers, like, know, addresses, week, science, coasters, pbs, digital, studios, want",20,Beginner,80.0,20.0,0.0,15,https://www.youtube.com/watch?v=3QhU9jd03a0,2017-09-13T20:55:06Z,CrashCourse
computer networks,frUQMHXhnvs,Basics of Cisco Packet Tracer Part 1,Computer Networks: Basics of Cisco Packet Tracer Part 1 Topics discussed: 1 The download procedure of Cisco Packet Tracer. 2 The basics of Cisco Packet Tracer. 3 Example packet tracer peer to peer network. Follow Neso Academy on Instagram: @nesoacademy Contribute: Memberships: Books: books Website Forum Facebook Twitter Software source: Music: Axol x Alex Skrindo You NCS Release ComputerNetworksByNeso ComputerNetwork CiscoPacketTracer,1473794,21176,12.43,"packet, tracer, cisco, basics, peer, books, computer, networks, part, topics, discussed, download, procedure, example, network, follow, neso, academy, instagram, nesoacademy",20,Beginner,53.33,46.67,0.0,15,https://www.youtube.com/watch?v=frUQMHXhnvs,2019-12-14T13:15:01Z,Neso Academy
computer networks,5ZuP5qjbKSI,Lec 58: Distance vector routing algorithm in hindi | Computer Networks,"Subscribe to our new channel: This video explains Distance vector routing algorithm. A router transmits its distance vector to each of its neighbours in a routing packet. Each router receives and saves the most recently received distance vector from each of its neighbours. It is distributed in nature, i.e., each node receives information from one or more of its directly attached neighbours nodes, performs the calculation, and then distributes the result back to its neighbours. Computer Networks ",1423328,22357,26.0,"neighbours, follow, subscribe, distance, vector, system, new, channel, routing, router, receives, computer, playlist, links, design, theory, query, data, instagram, video",20,Intermediate,33.33,60.0,6.67,15,https://www.youtube.com/watch?v=5ZuP5qjbKSI,2019-09-29T13:30:00Z,Gate Smashers
computer networks,U7-h2hyM1Dc,Lec 27: Introduction to Error detection and Correction | Computer Networks,"Subscribe to our new channel: In this video, Varun sir has explained Error Detection and Correction. Error detection and correction are techniques used in data communication and storage to ensure the accuracy and integrity of transmitted or stored data. The goal of error detection and correction is to detect errors and correct them to maintain data integrity. 0:00 Single bit error 4:44 Burst error Computer Networks Complete Playlist : 2joCpWOLUrDLvVV Other subject wise playlist Links: Design and",1407044,26806,10.73,"error, data, follow, subscribe, detection, correction, system, new, channel, integrity, computer, playlist, links, design, theory, query, instagram, video, varun, sir",20,Beginner,46.67,53.33,0.0,15,https://www.youtube.com/watch?v=U7-h2hyM1Dc,2018-11-29T05:30:03Z,Gate Smashers
computer networks,CRdL1PcherM,what is TCP/IP and OSI? // FREE CCNA // EP 3,What is the TCP/IP Model? OSI Model? // CCNA Course 200 301 sponsored by the Boson Software: affiliate Watch the whole course: ccna Go deeper: Join the NetworkChuck Academy : OFFICIAL NetworkChuck Coffee: Watch the whole course: ccna Install Packet Tracer: CCNA Episode 3 Packet Tracer Lab: 0:00 Intro 0:55 Birth of the internet 2:04 why we need a network model 3:58 the TCP/IP Model 6:12 the OSI Model 7:02 why we still talk about OSI 9:09 QUIZ TIME Get your CCNA with BOSON CCNA Lab: Boson NetSim a,1390198,46752,12.07,"ccna, boson, affiliate, model, course, networkchuck, osi, lab, watch, whole, coffee, packet, tracer, network, netsim, practice, exam, exsim, ccnp, buy",20,Beginner,26.67,53.33,20.0,15,https://www.youtube.com/watch?v=CRdL1PcherM,2020-08-06T17:34:32Z,NetworkChuck
computer networks,CtLxfFXq9cY,How to connect internet in computer shorts tips tricks trending,,2222909,32635,0.6,No keywords,0,Intermediate,40.0,60.0,0.0,15,https://www.youtube.com/watch?v=CtLxfFXq9cY,2023-12-08T12:19:07Z,AMERICAN ACADEMY RRC
computer networks,lg-f92uY1Lc,Lec 4: Physical layer in computer networks in hindi | Functions of Physical layer | OSI,"Subscribe to our new channel: In this video, Varun sir has discussed Physical layer of computer networks. Physical layer is the lowest or last layer of the OSI model. It is responsible for the physical transmission of data over the network. It deals with the actual hardware and physical components that enable communication between devices. 0:00 Introduction 1:52 Cables and Connectors 4:13 Topology 5:37 Hardware Repeaters, Hubs 6:34 Transmission mode 7:04 Multiplexing 8:32 Encoding Repeaters in C",1333035,20758,10.77,"computer, physical, networks, follow, subscribe, layer, data, system, new, channel, transmission, hardware, repeaters, playlist, links, design, theory, query, instagram, video",20,Beginner,13.33,73.33,13.33,15,https://www.youtube.com/watch?v=lg-f92uY1Lc,2019-03-03T06:57:20Z,Gate Smashers
computer networks,JRgmPco0KWI,Lec 21: Data link layer in computer Networks and its Responsibilities,"Subscribe to our new channel: In this video, Varun sir has explained Data Link layer. Data link layer is the second layer in the OSI Open Systems Interconnection model and the TCP/IP protocol suite. It is responsible for breaking the data received from the network layer into smaller units called frames and transmitting them over the physical medium. 0:00 Introduction 0:57 Hop to Hop 5:46 Flow Control 9:04 Error Control 12:19 Access Control 15:18 MAC address 16:41 Frames Computer Networks Complet",1333218,25521,19.38,"data, layer, follow, subscribe, control, system, new, channel, link, frames, hop, computer, playlist, links, design, theory, query, instagram, video, varun",20,Beginner,20.0,80.0,0.0,15,https://www.youtube.com/watch?v=JRgmPco0KWI,2018-04-17T06:16:38Z,Gate Smashers
computer networks,uSKdjjw5zow,Network Topology,Computer Networks: Network Topologies in Computer Networks Topics discussed: 1 Network Topology. 2 Physical and Logical Topology. 3 Bus Topology. 4 Ring Topology. 5 Star Topology. 6 Mesh Topology. 7 Hybrid Topology. Follow Neso Academy on Instagram: @nesoacademy Contribute: Memberships: Books: books Website Forum Facebook Twitter Music: Axol x Alex Skrindo You NCS Release ComputerNetworksByNeso ComputerNetwork NetworkTopology,1307097,21646,13.6,"topology, computer, networks, network, books, topologies, topics, discussed, physical, logical, bus, ring, star, mesh, hybrid, follow, neso, academy, instagram, nesoacademy",20,Intermediate,60.0,33.33,6.67,15,https://www.youtube.com/watch?v=uSKdjjw5zow,2019-11-09T13:30:02Z,Neso Academy
computer networks,M60fjg6FcXk,Types of Protocol in Hindi | Computer Networking,What is Computer Network? Please Like | Share | SUBSCRIBE our Channel.. Learn Coding Like our Facebook Page.... Learn Coding Don't forget to tag our Channel... protocol TypesofProtocols LearnCoding networkprotocol Networking whatisprotocol TCP/IP FTP HTTP SMTP POP IMAP PPP UDP computernetworking computernetwork networkprotocol || Content || 1. writer : ankush 2. voice : akhilesh Thank You,1286786,29963,18.65,"like, channel, learn, coding, networkprotocol, computer, network, please, share, subscribe, facebook, page, forget, tag, protocol, typesofprotocols, learncoding, networking, whatisprotocol, ftp",20,Intermediate,26.67,66.67,6.67,15,https://www.youtube.com/watch?v=M60fjg6FcXk,2021-05-09T03:29:36Z,Learn Coding
computer networks,rdb2ki4iGuo,Lec 48: Subnetting in Classful Addressing with Examples in Hindi | Computer Networks,"Subscribe to our new channel: Subnetting in Classful Addressing with Examples is explained in this video. Subnetting: Dividing the big network into small networks. Classful subnetting is a method of splitting a classful network number into two or more smaller subnets. The subnets will all be the same size, determined by the maximum number of hosts per subnet. A single custom subnet mask is used to configure the subnets Computer Networks Complete Playlist : 2joCpWOLUrDLvVV Other subject wise play",1288860,22021,19.28,"subnetting, follow, subscribe, classful, number, subnets, system, new, channel, big, network, networks, subnet, computer, playlist, links, design, theory, query, data",20,Intermediate,20.0,80.0,0.0,15,https://www.youtube.com/watch?v=rdb2ki4iGuo,2019-09-24T14:30:04Z,Gate Smashers
computer networks,vhfRArT11jc,Lec 76: Domain Name System DNS in computer Networks,"Subscribe to our new channel: Here, Varun sir has explained Domain Name System DNS in computer Networks The domain name system DNS is a naming database in which internet domain names are located and translated into Internet Protocol IP addresses. The domain name system maps the name people use to locate a website to the IP address that a computer uses to locate that website. Computer Networks Complete Playlist : 2joCpWOLUrDLvVV Other subject wise playlist Links: Design and Analysis of algorithms",1279336,23597,9.37,"system, domain, name, computer, follow, subscribe, dns, new, channel, networks, database, internet, locate, website, playlist, links, design, theory, query, data",20,Intermediate,20.0,80.0,0.0,15,https://www.youtube.com/watch?v=vhfRArT11jc,2018-12-22T12:37:14Z,Gate Smashers
computer networks,bdnZjFq80l4,Top 100 Computer Networking Mcqs | Networking mcq questions and answers,"Hi Guys... In this Video, You will learn Computer Networking Mcqs. Most commonly asked Networking Mcqs in Exams & Interview Please SUBSCRIBE our Channel @KeyPointsEducation Don't forget to tag our channel networkingmcq computernetworking networkingmcqs networking computernetworkingmcq Complete MS OFFICE Mcqs Thanks for Watching.. Keep learning, Keep Supporting",1228048,39960,35.1,"networking, mcqs, channel, keep, guys, video, learn, computer, commonly, asked, exams, interview, please, subscribe, keypointseducation, forget, tag, networkingmcq, computernetworking, networkingmcqs",20,Intermediate,20.0,73.33,6.67,15,https://www.youtube.com/watch?v=bdnZjFq80l4,2021-11-05T01:52:30Z,KeyPoints Education
computer networks,zoFSxIuS5Ro,Lec 53: IPv4 Header Format All Fields Explained in Hindi | Computer Networks,Subscribe to our new channel: This video explains IPv4 Header Format . All Fields are explained. IPv4 short for Internet Protocol Version 4 is the fourth version of the Internet Protocol IP . IP is responsible to deliver data packets from the source host to the destination host. This delivery is solely based on the IP Addresses in the packet headers. IPv4 is the first major version of IP. IPv4 is a connectionless protocol for use on packet switched networks. 0:00 IPv4 Header 5:43 Version VER 7:2,1175754,23676,18.42,"protocol, version, follow, subscribe, header, data, system, new, channel, internet, source, host, destination, packet, networks, computer, playlist, links, design, theory",20,Intermediate,20.0,73.33,6.67,15,https://www.youtube.com/watch?v=zoFSxIuS5Ro,2019-06-07T15:21:57Z,Gate Smashers
computer networks,R6WN4_bBB1Q,How TCP works IRL,,1280182,72643,0.65,No keywords,0,Intermediate,20.0,73.33,6.67,15,https://www.youtube.com/watch?v=R6WN4_bBB1Q,2024-02-14T22:23:29Z,Justin Garrison
computer networks,4_zSIXb7tLQ,"Network Types: LAN, WAN, PAN, CAN, MAN, SAN, WLAN","Network types depend on how large they are and how much of an area they cover geographically. This video explains the difference between a LAN vs WAN, along with other networks. LAN Local Area Network WAN Wide Area Network LAN WAN",1167385,20809,4.93,"network, area, lan, wan, types, depend, large, much, cover, geographically, video, explains, difference, along, networks, local, wide",17,Intermediate,40.0,46.67,13.33,15,https://www.youtube.com/watch?v=4_zSIXb7tLQ,2018-11-21T14:49:34Z,PowerCert Animated Videos
