topic,video_id,title,description,views,likes,duration_minutes,keywords,keyword_count,difficulty,positive_comments(%),neutral_comments(%),negative_comments(%),total_comments,video_url,published_at,channel_title
operating system concepts,PU9O3shK4wc,What is Operating System With Full Information? Hindi Quick Support,"WhatisOperatingSystem QuickSupport Technology What is Operating System With Full Information? Hindi Quick Support. video operating system operating system , video video . Website: Facebook: Twitter: Channel Instagram: support007 Youtube: Linkedin: Nakrani Channel Owner: Anil Nakrani",1337925,41587,9.27,"operating, system, video, channel, nakrani, whatisoperatingsystem, quicksupport, technology, full, information, hindi, quick, support, website, facebook, twitter, instagram, youtube, linkedin, owner",20,"This looks like a **Beginner** level query. Here's why:

*   **Repetitive Keywords and Basic Questions:** The query is full of repeated, basic keywords like ""what is operating system,"" ""quick support,"" ""video,"" and ""Hindi."" This suggests a novice user trying to understand very fundamental concepts.

*   **Seeking Simple Explanations:** The emphasis on ""full information"" (which, ironically, a beginner is unlikely to be able to process effectively), ""Hindi,"" and ""quick support"" points to a need for easily digestible, introductory materials.

*   **Search Engine Optimization (SEO) focus:** The phrase is keyword-stuffed to increase visibility and is not natural language.

*   **Lack of Specificity:** There's no indication of prior knowledge or specific areas of interest within operating systems (e.g., kernel architecture, process management, specific operating systems like Linux, etc.).

*   **Channel/Promotional Content:** The inclusion of social media links, channel names, and owner information suggests the origin is someone promoting content around a basic explanation of operating systems. This isn't an advanced technical inquiry.

Essentially, it appears to be a combination of very basic questions from someone new to the topic and an attempt to boost the visibility of a YouTube channel or website.",46.67,46.67,6.67,15,https://www.youtube.com/watch?v=PU9O3shK4wc,2020-12-01T10:03:46Z,Quick Support
operating system concepts,VjPgYcQqqN0,Basics of OS Computer System Operation,OS: Basics of Operating System Computer System Operation Topics Discussed: 1. Basics of OS. 2. The basic structure of a computer system. 3. CPU. 4. Device Controllers and Memory Controller. 5. Bootstrap Program. 6. Interrupts and System Calls. Follow Neso Academy on Instagram: @nesoacademy Contribute: Memberships: Books: books Website Facebook Twitter Music: Axol x Alex Skrindo You NCS Release OperatingSystemByNeso os OperatingSystem OSBasics ComputerSystemOperation,1309769,17649,18.15,"system, basics, computer, books, operating, operation, topics, discussed, basic, structure, cpu, device, controllers, memory, controller, bootstrap, program, interrupts, calls, follow",20,Beginner,42.86,57.14,0.0,14,https://www.youtube.com/watch?v=VjPgYcQqqN0,2017-08-05T04:30:30Z,Neso Academy
operating system concepts,WYo1SpUh9FI,FCFS First Come First Serve CPU Scheduling Algorithm with example | Operating System,"In this video. FCFS First Come First Serve CPU Scheduling algorithm has been discussed with a solved example. I have also explained how to find Response Time, Completion Time, average Waiting time and average turn around time. CPU Scheduling Criteria and various Times related to a Process: 8zU See Complete Playlists: Placement Series: Data Structures and Algorithms: grxuLl8LU Dynamic Programming: Operating Systems: // S1K3 x6ztBRD PNa DBMS: Connect & Contact Me: Facebook: Lectures CSIT Netjrf 31",1176714,16556,17.83,"time, first, cpu, scheduling, average, video, fcfs, come, serve, algorithm, discussed, solved, example, also, explained, find, response, completion, waiting, turn",20,"Based on the description, this video seems to be targeted towards a **Beginner** audience. Here's why:

*   **FCFS is a fundamental scheduling algorithm:** First-Come, First-Served is one of the simplest and most basic CPU scheduling algorithms. It's typically taught early in an operating systems course.
*   **Emphasis on basic metrics:** The video explicitly mentions explaining how to find response time, completion time, average waiting time, and average turnaround time. These are core performance metrics introduced when learning about scheduling algorithms.
*   **Solved example:** Using a solved example indicates a focus on teaching the basic application of the algorithm.
*   **Introductory language:** Terms like ""CPU scheduling criteria"" and ""various times related to a process"" suggest an introductory approach.
*   **Playlist context:** The inclusion in playlists labeled ""operating systems"" and ""placement series: data structures and algorithms"" implies it's part of foundational material.

While intermediate or advanced students may review FCFS, the described content and purpose point to it being designed for beginners learning the basics of CPU scheduling.",33.33,66.67,0.0,15,https://www.youtube.com/watch?v=WYo1SpUh9FI,2019-03-20T12:34:06Z,Jenny's Lectures CS IT
operating system concepts,0LtuQhNFFe0,"L 7.1: File System in Operating System | Windows, Linux, Unix, Android etc.","Hard Disk Architecture: GG cs In this video, you will get best introduction to file system in operating system. File system is integral part of all Operating system like Windows, Unix, Linux, Android etc. operatingsystem Timestamps: 00:00 Introduction 00:27 What is a File System? 01:48 Real Life Examples of Files 04:46 How Files Are Stored? 06:05 File System Mapping Explained Subscribe to our new channel: Operating System Complete Playlist : Other subject wise playlist Links: Design and Analysis",1107098,24580,9.92,"system, file, playlist, follow, operating, subscribe, complete, architecture, introduction, like, operatingsystem, files, new, channel, links, design, theory, computer, query, data",20,Beginner,13.33,86.67,0.0,15,https://www.youtube.com/watch?v=0LtuQhNFFe0,2020-05-21T08:45:14Z,Gate Smashers
operating system concepts,F321087yYy4,Introduction to RTOS Part 1 What is a Real Time Operating System RTOS ? | Digi Key Electronics,"A real time operating system RTOS is an operating system that runs multi threaded applications and can meet real time deadlines. See this article to read more about them: hymel/getting started with stm32 and nucleo part 3 how to run multiple threads with cmsis rtos interface An RTOS is often a lightweight operating system OS designed to run on microcontrollers. Much like general purpose operating systems, they offer a scheduler to run multiple threads or tasks, resource management such as file I",1030200,18741,11.57,"rtos, part, introduction, time, real, operating, run, system, threads, embedded, started, multiple, often, applications, meet, deadlines, nucleo, cmsis, interface, management",20,Beginner,40.0,60.0,0.0,15,https://www.youtube.com/watch?v=F321087yYy4,2021-01-04T14:00:03Z,DigiKey
operating system concepts,8XBtAjKwCm4,Operating System In One Shot by Anuj Bhaiya,"Hey guys, In this video, We will learn all about operating system Interview related concepts. This video is important for anyone who wants to learn about operating system important concepts for their interviews or upcoming exams. Spring Boot 0 to 100 batch is now Live Enrol from here: spring boot 0 to 100 1/ Notes here: Open in Browser: systems in one shot/ Download PDF: Topics covered in this video: 0:00 Introduction 0:37 What is an Operating System & Types of OS 2:49 Process vs Threads vs Prog",1022039,35299,71.32,"operating, system, one, shot, anuj, bhaiya, video, algorithms, interview, process, scheduling, shuttle, course, placement, concepts, deadlock, memory, management, fit, playlist",20,Beginner,20.0,73.33,6.67,15,https://www.youtube.com/watch?v=8XBtAjKwCm4,2023-06-03T12:07:31Z,Coding Shuttle by Anuj Bhaiya
operating system concepts,F2FmTdLtb_4,System Design Concepts Course and Interview Prep,"This complete system design tutorial covers scalability, reliability, data handling, and high level architecture with clear explanations, real world examples, and practical strategies. You will learn the core concepts you need to know for a system designs interview. Course developed by @hayk.simonyan Presentation slides: Design Concepts Course and Interview Prep Presentation Slides dd8abfd72e3e4b8eb3da402db13018cd Try interactive Databases courses we love, right in your browser: Databases Made p",999292,27558,53.63,"design, architecture, databases, system, learn, concepts, interview, course, presentation, slides, load, balancers, complete, tutorial, covers, scalability, reliability, data, handling, high",20,Beginner,80.0,13.33,6.67,15,https://www.youtube.com/watch?v=F2FmTdLtb_4,2024-07-25T13:36:47Z,freeCodeCamp.org
operating system concepts,qfUZBKDh9BY,Introduction To Computer System | Beginners Complete Introduction To Computer System,"Introduction To Computer System. Beginners Complete Introduction To Computer System. Definition, Components, Features And Characteristics Of Computer , ., , Introduction au syst me informatique , , , Pengantar Sistem Komputer , Introduzione al sistema informatico , In this video tutorial , you will learn a simplified introduction to the computer system. This video tutorial is specially designed for the beginners to learn the fundamental concepts related to computer. We will study the definition ",994044,15084,10.03,"computer, system, components, introduction, features, learn, data, beginners, definition, characteristics, video, tutorial, works, input, processed, user, two, types, type, called",20,Beginner,53.33,46.67,0.0,15,https://www.youtube.com/watch?v=qfUZBKDh9BY,2021-08-29T10:50:38Z,Learn Computer Science
operating system concepts,XXPBl20J22w,Structures of Operating System,Operating System: Structures of Operating System Topics discussed: STRUCTURES OF OPERATING SYSTEM: 1. Simple Structure. 2. Monolithic Structure. 3. Layered Structure. 4. Microkernels. 5. Modules. Follow Neso Academy on Instagram: @nesoacademy Contribute: Memberships: Books: books Website Forum Facebook Twitter Music: Axol x Alex Skrindo You NCS Release OperatingSystemByNeso os OperatingSystem OperatingSystemStructure,733157,11172,19.45,"operating, system, structure, structures, books, topics, discussed, simple, monolithic, layered, microkernels, modules, follow, neso, academy, instagram, nesoacademy, contribute, memberships, website",20,"**Intermediate**

Here's why:

*   **Beginner:** A beginner level would focus on very basic OS concepts, such as what an OS *is*, its role, and a few simple examples of OS types.

*   **Intermediate:** The topics listed (simple, monolithic, layered, microkernels, modules) are fundamental architectural structures of operating systems. Understanding these requires some prior knowledge of operating system principles.
*   The listed structures are common topics in an **undergraduate** course of OS.

*   **Advanced:** Advanced topics would delve into much deeper issues like research in OS design, specific kernel implementations, or performance analysis of different architectures.",21.43,71.43,7.14,14,https://www.youtube.com/watch?v=XXPBl20J22w,2018-04-25T14:30:00Z,Neso Academy
operating system concepts,9GDX-IyZ_C8,Operating System Basics,Essential concepts of operating systems. Part of a larger series teaching programming. Visit,708425,11556,23.27,"essential, concepts, operating, systems, part, larger, series, teaching, programming, visit",10,Beginner,53.33,40.0,6.67,15,https://www.youtube.com/watch?v=9GDX-IyZ_C8,2013-10-11T03:54:06Z,Brian Will
operating system concepts,yK1uBHPdp30,Operating Systems Course for Beginners,Learn fundamental and advanced operating system concepts in 25 hours. This course will give you a comprehensive understanding of how operating systems function and manage resources. Course created by Kshitij Sharma. Course resources: Support for this channel comes from our friends at Scrimba the coding platform that's reinvented interactive learning: Contents 0:00:00 Welcome to the Course 0:03:43 Introduction and Background 1:28:56 Process Management 2:47:34 CPU Scheduling 6:12:23 Process Synchr,682488,20464,51.93,"course, management, learn, operating, resources, process, fundamental, advanced, system, concepts, hours, give, comprehensive, understanding, systems, function, manage, created, kshitij, sharma",20,Beginner,20.0,73.33,6.67,15,https://www.youtube.com/watch?v=yK1uBHPdp30,2024-08-06T14:25:53Z,freeCodeCamp.org
operating system concepts,ktP8QsPzKfs,Operating System Notes for Tech Placements @ApnaCollegeOfficial,Operating System Notes for Placements/Interviews : link Complete C++ Placement Course Data Structures+Algorithm : Telegram: Instagram: My YouTube Gear : rHFXNqQodOTYr7z EhH37s8pvtYpR0vMR4/edit?usp=sharing Notes of this Lecture:,676169,15228,3.6,"notes, operating, system, link, complete, placement, course, data, telegram, instagram, youtube, gear, lecture",13,"This resource appears to be targeted towards **Intermediate** level preparation. Here's why:

*   **Operating System Notes for Placements/Interviews:** This suggests a focus on concepts relevant to securing a job, implying a deeper understanding than just basic OS definitions. Placement-focused content usually requires problem-solving and application of knowledge.
*   **Complete C++ Placement Course, Data Structures + Algorithm:** These topics are fundamental for most tech interviews, placing the target audience beyond the ""beginner"" level. While beginners might learn basic syntax, placement preparation necessitates strong DSA knowledge.
*   **Lecture Notes:** The availability of lecture notes suggests a structured learning environment, which is more typical of intermediate-level courses.
*   **Telegram, Instagram, YouTube Gear:** These elements indicate community engagement and production quality, potentially catering to students actively pursuing placements, which are more commonly targeted at intermediate levels
*   The repetition and the ""edit?usp=sharing"" link suggest a working document meant for a wider audience.

Therefore, while beginners *could* use parts of this, the overall focus and content points to an **Intermediate** level resource designed for placement/interview preparation.",20.0,80.0,0.0,15,https://www.youtube.com/watch?v=ktP8QsPzKfs,2021-07-14T15:43:20Z,Apna College
operating system concepts,agaLaSafbwc,Computer Fundamental Full Course for Beginners in Just 1 Hour | Basics of Computer in One Shot,"Join WhatsApp Channel Notes & PDF : In this video, learn the basic computer course in Hindi to build a strong foundation in computer knowledge Perfect for beginners, this computer basic full course in Hindi covers essential topics, providing step by step guidance for anyone looking to improve their computer skills. Whether you're starting with a basic computer course in Hindi playlist or learning the basic course of computer, this video is designed to help you grasp the fundamentals with ease. J",633893,19016,75.1,"computer, basic, course, hindi, full, playlist, one, shot, join, video, knowledge, tally, step, guidance, skills, learning, everyone, basics, day, excel",20,Beginner,26.67,66.67,6.67,15,https://www.youtube.com/watch?v=agaLaSafbwc,2024-11-15T12:45:00Z,Computer Tech Academy
operating system concepts,dOiA2nNJpc0,Introduction to Operating System | Full Course for Beginners Mike Murphy Lecture for Sleep & Study,"Listen to our full course on operating systems for beginners In this comprehensive series of lectures, Dr. Mike Murphy will provide a detailed overview of the essential concepts and structures that make up an operating system. From hardware resources such as CPU and memory to disk input & output and disk scheduling, we will delve deep into the development cycles and requirements analysis for the OS's effective functioning. The course will also cover crucial topics like CPU features, kernel archi",578567,14449,279.4,"memory, uml, diagrams, operating, resources, cpu, disk, kernel, allocation, design, object, oriented, interrupt, page, course, systems, lectures, mike, murphy, system",20,Beginner,20.0,60.0,20.0,15,https://www.youtube.com/watch?v=dOiA2nNJpc0,2023-06-15T02:00:10Z,LECTURES FOR SLEEP & STUDY
operating system concepts,wvXr1Dv5czI,Operating System MCQs | For All Competitive Exams,operating system operating system mcq os mcq computer mcq computer operating system computer operating system mcq computer fundamental computer basic computer science questions and answers computer multiple choice questions computer mcq quiz computer mcq online test computer gk computer Important Mcqs computer mcq for competitive exams computer mcq for all exams computer operating system multiple choice questions operating system multiple choice questions,528459,15888,23.83,"computer, mcq, operating, system, questions, multiple, choice, exams, fundamental, basic, science, answers, quiz, online, test, important, mcqs, competitive",18,Beginner,6.67,73.33,20.0,15,https://www.youtube.com/watch?v=wvXr1Dv5czI,2022-01-02T12:21:10Z,KeyPoints Education
operating system concepts,GjNp0bBrjmU,How Do Operating Systems Work?,"Download your Operating Systems teacher resource pack try this video with built in interactive questions FREE operatingsystems interface software informationtechnology ClickView In this animated program, our character Sam shows students the basics of the hard working operating system. The video explains how an operating system interacts with various other software and hardware, and why the kernel is important. Students will also learn about primary and secondary memory, device management, and ho",503269,6521,3.5,"operating, free, system, video, interface, software, clickview, students, videos, explore, download, systems, teacher, resource, pack, try, built, interactive, questions, operatingsystems",20,Beginner,33.33,60.0,6.67,15,https://www.youtube.com/watch?v=GjNp0bBrjmU,2018-09-24T07:36:57Z,ClickView
operating system concepts,iWET9-DTp3Y,Master Class || Computer || Operating System || Preeti Ma'am || 28th June @8AM,UPSSSC PET 2023 NOTIFICATION: k UP POLICE NEW VACANCY 2023: M2icJtHjmZ9Y1yxLL RcxK Download Exampur Official App : Visit Our Website : OUR ONLINE COURSE UPSI 2020 NEW BATCH : UP JAIL WARDER NEW COURSE LAUNCH : SSC CPO TIER 1 FOUNDATION BATCH 2020 : 2020 34+ : SSC STENO BOOSTER BATCH : SSC CGL TIER 2 MAINS : Subscribe Our YouTube Channels : Exam : ay0bolPew?view as=subscriber Exam Law School : jJ1fWVTlO60zFCdim9r5Q?view as=subscriber IAS PCS By Exam : as=subscriber Tech : as=subscriber Bank : 8MO,501918,14695,159.47,"exampur, ssc, vivek, sir, upsi, exam, view, follow, police, new, official, batch, upsssc, notification, course, jail, warder, tier, cgl, school",20,Advanced,28.57,64.29,7.14,14,https://www.youtube.com/watch?v=iWET9-DTp3Y,2020-06-28T05:35:38Z,Exam
operating system concepts,A4G0hOI6XyQ,Complete OS Operating System In One Shot 7 Hours | In Hindi,OS in one shot Free Notes : pZt22xu0tm5VAEkif/view?usp=sharing Topics 0:00 Introduction 26:00 Structure of OS 53:00 Process Basics 1:25:40 CPU Scheduling 2:26:20 Process Synchronization 3:10:00 Semaphores 3:54:00 Deadlock 4:27:00 Memory Management 5:49:11 Virtual Memory 6:19:30 Disk Management 6:46:00 File System,442601,7334,421.15,"process, memory, management, one, shot, free, notes, topics, introduction, structure, basics, cpu, scheduling, synchronization, semaphores, deadlock, virtual, disk, file, system",20,Beginner,40.0,60.0,0.0,15,https://www.youtube.com/watch?v=A4G0hOI6XyQ,2024-02-16T08:10:25Z,5 Minutes Engineering
operating system concepts,NzyuxPtrRRM,Operating Systems Ch01 Part01,: : MGOs6ib0oK1z9C46DeKd9rRcSMY pdf LnR7MSMdFK1KQlnYOp?usp=sharing Operating Systems Chapter 01 Part 01 | : Computer System Structure : : Hardware Operating System Application Programs Users . . What is an Operating System? : . . What Operating Systems Do? : . . : Threads CPU Scheduling . : . . . : . . Operating Systems OS Computer Science System Structure OperatingSystemBasics MemoryManagement CPUScheduling ProcessManagement,431466,5133,25.95,"operating, system, systems, computer, structure, pdf, chapter, part, hardware, application, programs, users, threads, cpu, scheduling, science, operatingsystembasics, memorymanagement, cpuscheduling, processmanagement",20,Beginner,0.0,100.0,0.0,15,https://www.youtube.com/watch?v=NzyuxPtrRRM,2020-11-26T12:38:14Z,Dr. Ahmed Hagag
operating system concepts,eP_P4KOjwhs,Why Applications Are Operating System Specific,"This video was sponsored by Brilliant. To try everything Brilliant has to offer free for a full 30 days, visit You ll also get 20% off an annual premium subscription. Join CodeCrafters and learn by creating your own: Redis, Git, Http server, Interpreter, Grep... in your favorite programming language: In this video we explain why applications do not run on operating systems for which they are not intended. Questions and business contact: contact.coredumped@gmail.com Sponsor my work on Github: Joi",357743,24672,13.15,"video, brilliant, join, server, sponsored, try, everything, offer, free, full, days, visit, also, get, annual, premium, subscription, codecrafters, learn, creating",20,"Based on the description, the video is likely targeted towards an **Intermediate** audience. Here's why:

*   **""Why applications are operating system specific""**: This topic delves into the core concepts of how applications interact with the operating system, which is beyond a beginner's understanding. Beginners might not grasp the nuances of system calls, APIs, and how code needs to be compiled for a specific OS.
*   **Mentions of ""redis, git, http server, interpreter, grep""**: These are tools and technologies that someone with some programming experience would recognize. While a beginner *might* have heard of them, they likely haven't worked with them enough to fully appreciate the video's context.
*   **""learn by creating your own""**: This suggests a hands-on approach, implying the viewer is comfortable with coding and wants to understand the underlying mechanisms.
*   **Sponsorship by Brilliant & Codecrafters**: These platforms tend to focus on more advanced coding and problem-solving skills, further indicating an intermediate level.
*   **Focus on *why***: The core topic focuses on *why* things are the way they are, rather than simply *what* they are. This implies a level of understanding and curiousity beyond that of a beginner.

While the video might contain some information useful to a motivated beginner, the core concepts and level of assumed knowledge point toward an intermediate-level audience. It's unlikely to be advanced, as the core topic is foundational rather than highly specialized.",53.33,40.0,6.67,15,https://www.youtube.com/watch?v=eP_P4KOjwhs,2025-01-24T19:00:25Z,Core Dumped
operating system concepts,oPn_adlC1Q0,What is an Embedded System? | Concepts,"Purchase your FPGA Development Board here: Boards Compatible with the tools I use in my Tutorials: What is an Embedded System? Are you interested in Embedded Systems with development boards? Or you just want to know what is an Embedded System? My name is Greidi and I'm an Electrical Engineer, I'm here to help you understand the basics of Embedded Systems. Subscribe for new tutorials, product reviews, and conceptual videos. Feel free to leave a comment for any questions you may have. Sources used",346412,7186,1.95,"embedded, system, systems, development, boards, tutorials, free, purchase, fpga, board, compatible, tools, use, interested, want, know, name, greidi, electrical, engineer",20,Beginner,40.0,60.0,0.0,15,https://www.youtube.com/watch?v=oPn_adlC1Q0,2018-08-01T14:13:24Z,Simple Tutorials for Embedded Systems
