topic,video_id,title,description,views,likes,duration_minutes,keywords,keyword_count,difficulty,positive_comments(%),neutral_comments(%),negative_comments(%),total_comments,video_url,published_at,channel_title
machine learning advanced,fUEwoiC5AO0,Humanoid robot warns of AI dangers,"A humanoid robot named Ameca was asked what a nightmare AI scenario would look like at a London robotics conference on June 1. Developed by the British company Engineered Arts, Ameca is not only capable of having conversations, but also mimicking facial expressions and body language. Subscribe: Livestream: Facebook: Twitter: Instagram: Visit our website:",2909070,136326,0.88,"ameca, humanoid, robot, named, asked, nightmare, scenario, would, look, like, london, robotics, conference, june, developed, british, company, engineered, arts, capable",20,"**Intermediate**

Here's why:

*   **Topic Complexity:** The subject matter, the dangers of AI and a robot expressing opinions on the topic, can be intellectually stimulating and require some background knowledge in AI ethics and robotics.
*   **Vocabulary:** The vocabulary used (nightmare scenario, robotics conference, developed, capable, mimicking facial expressions) is not basic beginner-level vocabulary.
*   **Sentence Structure:** While the sentences aren't overly complex, they do contain descriptive phrases and details that require some level of reading comprehension.
*   **Implied Context:** Understanding the full impact of the robot's statement requires grasping the potential societal implications of advanced AI, which goes beyond simply understanding the words.

A beginner-level example would likely focus more on the robot's physical attributes and basic functionality, whereas an advanced one would dive deeper into the AI algorithms and the philosophical implications of robot sentience.",20.0,46.67,33.33,15,https://www.youtube.com/watch?v=fUEwoiC5AO0,2023-06-01T19:38:34Z,TRT World
machine learning advanced,qYNweeDHiyU,"AI, Machine Learning, Deep Learning and Generative AI Explained","Want to learn more about Agentic AI + Data? Register here Want to play with the technology yourself? Explore our interactive demo Join Jeff Crume as he dives into the distinctions between Artificial Intelligence AI , Machine Learning ML , Deep Learning DL , and Foundation Models and how these technologies have evolved over time. He also explores the latest advancements in Generative AI, including large language models, chatbots, and deepfakes and clarifies common misconceptions, simplifies compl",2221042,53464,10.02,"want, learning, models, technologies, learn, agentic, data, register, play, technology, explore, interactive, demo, join, jeff, crume, dives, distinctions, artificial, intelligence",20,Advanced,40.0,46.67,13.33,15,https://www.youtube.com/watch?v=qYNweeDHiyU,2024-08-05T11:00:52Z,IBM Technology
machine learning advanced,uz6vFX91dg8,What is Machine Learning?? Dr Tanu Jain Interview upscinterview upscaspirants shortsfeed fypage,"Become a Channel Member & Unlock Exclusive Perks Members only Shorts,Direct connection with us, etc Join by Clicking Here: What is Machine Learning?? Dr Tanu Jain Asked very interesting Question. shortsfeed motivation iasinterviwes civilserviceinterview fypage upsc iasinterveiw publicserviceinterview interview iasintrview fypage fypyoutube fypviral fyp fypp fypviral drishtiiasinterview drishtiias drishti ias iasintrview ias iasinterview iasinterview ips ipsinterview ipsofficer ipsmotivationalvid",4129885,78745,0.33,"fypage, iasintrview, fypviral, ias, iasinterview, become, channel, member, unlock, exclusive, perks, members, shorts, direct, connection, etc, join, clicking, machine, learning",20,"Beginner.

**Reasoning:**

The question ""what is machine learning?"" is a fundamental concept in the field, making it a beginner-level topic. The context of the video, targeting UPSC aspirants, suggests an introductory level explanation would be appropriate. The overall content appears to be aimed at giving a basic understanding rather than delving into advanced techniques or research aspects of machine learning.",20.0,40.0,40.0,15,https://www.youtube.com/watch?v=uz6vFX91dg8,2025-02-17T14:31:02Z,UPSC Brilliance
machine learning advanced,bPrmA1SEN2k,Complete Road Map To Be Expert In Python Follow My Way,"In this videos we are going to discuss about the complete road map to be a expert in python programming. Python has been the most versatile programming language through which you can select any path such as web development, machine learning ,data scientist, data analyst Visit Python AI Tech news : EKX Python With Complete Ml playlist: Please join as a member in my channel to get additional benefits like materials in Data Science, live streaming for Members and many more lfiiWBdtULKOw6X0Dig/join ",2196195,23279,29.18,"learning, machine, data, python, complete, playlist, science, hours, deep, programming, please, channel, learn, statistics, hindi, videos, going, discuss, road, map",20,Advanced,46.67,53.33,0.0,15,https://www.youtube.com/watch?v=bPrmA1SEN2k,2020-09-18T14:15:12Z,Krish Naik
machine learning advanced,R6u5EBWAssY,"Reality behind data science, machine learning jobs",Reality behind data science jobs. Is machine learning really cool? Do you want to learn technology from me? Check for my affordable video courses. My Website For Video Courses: source=description&utm medium=yt&utm campaign=description&utm id=description Need help building software or data analytics and AI solutions? My company can help. Click on the Contact button on that website. Codebasics Hindi channel: Social Media Discord: Dhaval's Personal Instagram: Instagram: Facebook: Twitter: Linkedin ,2139865,85315,0.88,"video, utm, data, courses, website, help, codebasics, personal, instagram, linkedin, reality, behind, science, jobs, machine, learning, really, cool, want, learn",20,Beginner,33.33,40.0,26.67,15,https://www.youtube.com/watch?v=R6u5EBWAssY,2022-02-16T12:55:12Z,codebasics
machine learning advanced,NWONeJKn6kc,Machine Learning Course for Beginners,"Learn the theory and practical application of machine learning concepts in this comprehensive course for beginners. Learning resources: Project Sources Code and Learning Materials Code: Project Sources Code and Learning Materials Course developed by Ayush Singh. Check out his channel: Try interactive AI courses we love, right in your browser: AI Made possible by a grant from our friends at Scrimba Course Contents 0:00:00 Course Introduction 0:04:34 Fundamentals of Machine Learning 0:25:22 Superv",1897065,54678,592.32,"learning, project, course, code, unsupervised, learn, theory, machine, sources, materials, regression, price, predictor, ensemble, boosting, practical, application, concepts, comprehensive, beginners",20,Beginner,13.33,73.33,13.33,15,https://www.youtube.com/watch?v=NWONeJKn6kc,2021-08-30T13:23:10Z,freeCodeCamp.org
machine learning advanced,01sAkU_NvOY,Advanced Computer Vision with Python Full Course,"Learn advanced computer vision using Python in this full course. You will learn state of the art computer vision techniques by building five projects with libraries such as OpenCV and Mediapipe. If you are a beginner, don't be afraid of the term advance. Even though the concepts are advanced, they are not difficult to follow. This course was developed by Murtaza Hassan. Check out his Murtaza's Workshop YouTube Channel: Get the code here: computer vision with python/ Learn to build computer visio",1893576,63677,400.68,"chapter, vision, project, learn, computer, basics, module, face, python, course, murtaza, advanced, get, code, mobile, hand, tracking, pose, estimation, detection",20,Beginner,26.67,66.67,6.67,15,https://www.youtube.com/watch?v=01sAkU_NvOY,2021-05-27T13:50:46Z,freeCodeCamp.org
machine learning advanced,h0e2HAPTGF4,11. Introduction to Machine Learning,"MIT 6.0002 Introduction to Computational Thinking and Data Science, Fall 2016 View the complete course: 0002F16 Instructor: Eric Grimson In this lecture, Prof. Grimson introduces machine learning and shows examples of supervised learning using feature vectors. License: Creative Commons BY NC SA More information at More courses at",1758405,25239,51.52,"grimson, learning, mit, introduction, computational, thinking, data, science, fall, view, complete, course, instructor, eric, lecture, introduces, machine, shows, examples, supervised",20,Beginner,40.0,60.0,0.0,15,https://www.youtube.com/watch?v=h0e2HAPTGF4,2017-05-19T14:22:40Z,MIT OpenCourseWare
machine learning advanced,4b4MUYve_U8,Stanford CS229: Machine Learning Linear Regression and Gradient Descent | Lecture 2 Autumn 2018,"For more information about Stanford s Artificial Intelligence professional and graduate programs, visit: This lecture covers supervised learning and linear regression. Andrew Ng Adjunct Professor of Computer Science To follow along with the course schedule and syllabus, visit: autumn2018.html andrewng machinelearning Chapters: 00:00 Intro 00:45 Motivate Linear Regression 03:01 Supervised Learning 04:44 Designing a Learning Algorithm 08:27 Parameters of the learning algorithm 14:44 Linear Regress",1666380,17595,78.28,"learning, algorithm, gradient, descent, linear, regression, visit, supervised, information, stanford, artificial, intelligence, professional, graduate, programs, lecture, covers, andrew, adjunct, professor",20,Beginner,26.67,60.0,13.33,15,https://www.youtube.com/watch?v=4b4MUYve_U8,2020-04-17T20:08:06Z,Stanford Online
machine learning advanced,1vsmaEfbnoE,Detailed Roadmap for Machine Learning | Free Study Resources | Simply Explained,Telegram: Instagram: Resources of this Lecture : 1CKbnJ6LHCgIYIaKsQ/edit?usp=sharing,1536709,57097,14.98,"telegram, instagram, resources, lecture",4,"This looks like an **Intermediate** level offering. Here's why:

*   **Detailed roadmap for machine learning:** Roadmaps imply a structured, multi-step approach that goes beyond the absolute basics. Beginners typically need a very simplified overview, not a roadmap.
*   **Free study resources:** Resources suggest curated content, which is more aligned with learners who are building on a foundational understanding.
*   **Simply explained:** While the ""simply explained"" aims for accessibility, the mention of Machine Learning (ML) implies a level of conceptual sophistication that can be classified as Intermediate.
*   **Telegram, Instagram links:** Social media engagement is common at all levels, but sharing lecture resources is more common for students already invested in a formal (or informal) learning process.

**In summary:** The combination of a roadmap, study resources, and the core topic of machine learning suggests the target audience isn't a total beginner, but someone who has a basic understanding and wants to delve deeper.",6.67,80.0,13.33,15,https://www.youtube.com/watch?v=1vsmaEfbnoE,2021-06-07T16:56:35Z,Apna College
machine learning advanced,9vM4p9NN0Ts,Stanford CS229 I Machine Learning I Building Large Language Models LLMs,"For more information about Stanford's Artificial Intelligence programs visit: This lecture provides a concise overview of building a ChatGPT like model, covering both pretraining language modeling and post training SFT/RLHF . For each component, it explores common practices in data collection, algorithms, and evaluation methods. This guest lecture was delivered by Yann Dubois in Stanford s CS229: Machine Learning course, in Summer 2024. Yann Dubois PhD Student at Stanford About the speaker: Yann",1509512,42177,104.52,"llms, stanford, evaluation, overview, language, training, yann, dubois, models, importance, tokenization, programs, visit, lecture, pretraining, modeling, component, data, methods, phd",20,Beginner,33.33,66.67,0.0,15,https://www.youtube.com/watch?v=9vM4p9NN0Ts,2024-08-27T22:02:57Z,Stanford Online
machine learning advanced,JxgmHe2NyeY,Complete Machine Learning In 6 Hours| Krish Naik,All the materials are available in the below link Grand Complete Data Science Materials/tree/main Visit for data sscience blogs Time Stamp: 00:00:00 Introduction 00:01:25 AI Vs ML vs DL vs Data Science 00:07:56 Machine LEarning and Deep Learning 00:09:05 Regression And Classification 00:18:14 Linear Regression Algorithm 01:07:14 Ridge And Lasso Regression Algorithms 01:33:08 Logistic Regression Algorithm 02:13:52 Linear Regression Practical Implementation 02:28:30 Ridge And Lasso Regression Prac,1503343,24937,397.87,"learning, algorithms, machine, regression, algorithm, data, clustering, science, deep, practical, implementation, tree, classifier, hours, complete, classification, linear, ridge, lasso, decision",20,Beginner,33.33,66.67,0.0,15,https://www.youtube.com/watch?v=JxgmHe2NyeY,2022-05-28T04:37:31Z,Krish Naik
machine learning advanced,yN7ypxC7838,All Machine Learning Models Explained in 5 Minutes | Types of ML Models Basics,"Get Certified in Artificial Intelligence & Machine Learning. Both tech and Non Tech can apply 10% off on AI Certifications. Use Coupon Code save10 Confused about understanding machine learning models? Well, this video will help you grab the basics of each one of them. From what they are, to why they are used, and what purpose do they serve. All Major Software Architecture Patterns Explained in 7 Minutes | Meaning, Design, Models & Examples 7 Basic Machine Learning Concepts for Beginners What is ",1481009,33595,5.02,"learning, machine, models, explained, types, common, get, understanding, basics, works, model, tech, video, beginners, deep, neural, network, step, supervised, unsupervised",20,Beginner,40.0,53.33,6.67,15,https://www.youtube.com/watch?v=yN7ypxC7838,2020-05-16T01:59:09Z,Learn with Whiteboard
machine learning advanced,LvC68w9JS4Y,Machine Learning FULL Course with Practical 10 HOURS | Learn Free ML in 2025 | Part 1,"Machine Learning Full Course for Beginners 2025 | Learn Machine Learning in 10 Hours Part 1 To learn Data Analytics Course online with regular LIVE CLASSES, enroll now: pages/online data analytics course.html?utm source=YouTube&utm medium=April2024 12&utm campaign=RV 00:00:00 ML Course Introduction 00:01:03 What is Machine learning ML 00:17:19 Complete Roadmap To Learn Machine Learning 00:26:16 Types of Variables in Machine Learning 00:38:24 Data Cleaning in Machine Learning 00:45:15 What is mis",1452936,40261,616.78,"regression, data, machine, learning, learn, practical, course, linear, classification, wscube, tech, missing, using, regularization, logistic, skills, full, utm, handling, values",20,Beginner,26.67,53.33,20.0,15,https://www.youtube.com/watch?v=LvC68w9JS4Y,2024-04-15T13:30:09Z,WsCube Tech
machine learning advanced,4RixMPF4xis,AI vs Machine Learning,"Learn more about watsonx: What is really the difference between Artificial intelligence AI and machine learning ML ? Are they actually the same thing? In this video, Jeff Crume explains the differences and relationship between AI & ML, as well as how related topics like Deep Learning DL and other types and properties of each. ai ml dl artificialintelligence machinelearning deeplearning watsonx",1439548,42066,5.82,"watsonx, learning, learn, really, difference, artificial, intelligence, machine, actually, thing, video, jeff, crume, explains, differences, relationship, well, related, topics, like",20,"I would classify this as **Beginner**.

Here's why:

*   **Focus on fundamental concepts:** The description centers around understanding the core difference between AI and ML, which is a basic question for anyone starting to explore the field.
*   **Clear explanation implied:** It mentions a video explaining the differences and relationship. This suggests an introductory approach.
*   **Broad overview:** Terms like deep learning are mentioned, but in the context of ""related topics,"" implying a general overview rather than an in-depth exploration.
*   **No prerequisites assumed:** The description doesn't assume any prior knowledge of AI or ML.
*   **Simplified Language**: The language is straightforward and easy to understand.

While it touches on ""deep learning,"" the primary focus is on clarifying the foundational concepts of AI and ML, making it suitable for beginners.",40.0,60.0,0.0,15,https://www.youtube.com/watch?v=4RixMPF4xis,2023-04-10T11:00:03Z,IBM Technology
machine learning advanced,4dwsSz_fNSQ,"Supervised, Unsupervised and Reinforcement Learning in Artificial Intelligence in Hindi",Subscribe to our new channel: Artificial Intelligence Complete Playlist : nwb0HR5US5GFKFI Other subject wise playlist Links: Operating System : Database Management System: Theory of Computation 76adtyb4ef7i Data Structure : Computer Networks Complete Playlist : 2joCpWOLUrDLvVV Computer Architecture Complete Playlist : Structured Query Language SQL : SITyuSIcD93id Discrete Mathematics: Compiler Design: Number System: Cloud Computing & BIG Data: O52MsrdUSrzuy4 Software Engineering: Design and Anal,1413950,29143,9.47,"playlist, complete, follow, subscribe, system, new, channel, links, theory, data, computer, query, design, instagram, artificial, intelligence, subject, wise, operating, database",20,"Let's break this down. The core topics mentioned are:

*   **Supervised Learning, Unsupervised Learning, and Reinforcement Learning:** These are the foundational pillars of Machine Learning, a subfield of Artificial Intelligence.

Given this and the context of the YouTube channel focusing on computer science topics for GATE (Graduate Aptitude Test in Engineering) exams, the likely audience is students and professionals.

Considering this, I'd classify this content as **Intermediate**.

Here's why:

*   **Beginner:** A beginner level would likely focus on *what* AI is, give simple examples, and avoid technical details. Just defining what ""learning"" is and the most basic ideas.
*   **Intermediate:** This assumes the user has some basic understanding of computers and programming. Introducing the three main paradigms is a common step after a beginner's overview. It involves some conceptual understanding but likely avoids heavy mathematical formalization.
*   **Advanced:** An advanced level would delve into the mathematical underpinnings (algorithms, loss functions, optimization techniques), implementation details, and current research trends within each learning paradigm.

Therefore, presenting Supervised, Unsupervised, and Reinforcement Learning *as core concepts* falls under the **Intermediate** category because it's a crucial step in progressing from introductory AI knowledge to more in-depth understanding and practical application. The description also aims to cater to exam preparation, implying a need for understanding concepts rather than just basic awareness.",46.67,53.33,0.0,15,https://www.youtube.com/watch?v=4dwsSz_fNSQ,2019-06-04T15:58:18Z,Gate Smashers
machine learning advanced,E0Hmnixke2g,All Machine Learning algorithms explained in 17 min,"All Machine Learning algorithms intuitively explained in 17 min I just started my own Patreon, in case you want to support Patreon Link: In this video I will go through all machine learning algorithms in less than 17 minutes to get you an intuitive understanding of how they work and how they relate to each other as well as help you decide how to pick the right one for your problem. Going all the way from Linear Regression to Neural Networks / Deep Learning and Unsupervised Learning. Also Watch: ",1327798,52194,16.5,"learning, machine, algorithms, regression, unsupervised, patreon, support, linear, neural, networks, deep, learn, intuitively, explained, min, started, case, want, link, video",20,Beginner,46.67,46.67,6.67,15,https://www.youtube.com/watch?v=E0Hmnixke2g,2024-09-17T08:57:32Z,Infinite Codes
machine learning advanced,iIkJrwVUl1c,Project 1: End To End Python ML Project Complete | Machine Learning Tutorials Using Python In Hindi,"Update 2025: I have launched a fresh Data Science course with all the modules required to become job ready. If you are seeing this comment, the course is on an early bird offer. The course comes with Handbook, projects and fresh content Enroll here: ultimate job ready data science course I look forward to see you in the course Python Udemy Course: Get this course at 90% Discount if you use this link This machine learning project using python in Hindi is created to give you a complete understandi",1321626,31336,186.33,"course, python, data, hindi, learning, video, using, complete, machine, science, real, jupyter, notebook, problem, tutorials, learn, one, fresh, job, ready",20,Advanced,46.67,46.67,6.67,15,https://www.youtube.com/watch?v=iIkJrwVUl1c,2019-08-13T13:48:52Z,CodeWithHarry
machine learning advanced,61a7UkDO50s,Python Programming Course in Hindi Advanced,Python Udemy Course: Get this course at 90% Discount if you use this link Chapterwise and Step by Step Python Tutorial in Hindi : Learn Python Programming Language in Hindi using this complete Python Hindi course. This Python Tutorial video will discuss the advanced features of Python programming language. This complete python programming course will teach you coding in python as well as everything you need to know about advanced python. Beginners who have already learnt python can watch this vi,1278021,37125,203.83,"python, course, hindi, advanced, programming, complete, video, learn, using, chapter, tutorial, language, beginners, watch, hour, one, step, coding, hours, practice",20,Beginner,20.0,73.33,6.67,15,https://www.youtube.com/watch?v=61a7UkDO50s,2020-09-25T14:15:52Z,CodeWithHarry
machine learning advanced,9Y3yaoi9rUQ,Algorithmic Trading Machine Learning & Quant Strategies Course with Python,"In this comprehensive course on algorithmic trading, you will learn about three cutting edge trading strategies to enhance your financial toolkit. In the first module, you'll explore the Unsupervised Learning Trading Strategy, utilizing S&P 500 stocks data to master features, indicators, and portfolio optimization. Next, you'll leverage the power of social media with the Twitter Sentiment Investing Strategy, ranking NASDAQ stocks based on engagement and evaluating performance against the QQQ ret",1134698,19057,179.33,"trading, strategy, course, learn, learning, intraday, utm, python, building, algorithmic, unsupervised, stocks, data, indicators, twitter, sentiment, investing, garch, model, code",20,Beginner,66.67,26.67,6.67,15,https://www.youtube.com/watch?v=9Y3yaoi9rUQ,2023-10-26T12:36:51Z,freeCodeCamp.org
machine learning advanced,ELE2_Mftqoc,Reinforcement Learning Course Full Machine Learning Tutorial,"Reinforcement learning is an area of machine learning that involves taking right action to maximize reward in a particular situation. In this full tutorial course, you will get a solid foundation in reinforcement learning core topics. The course covers Q learning, SARSA, double Q learning, deep Q learning, and policy gradient methods. These algorithms are employed in a number of environments from the open AI gym, including space invaders, breakout, and others. The deep learning portion uses Tens",1046061,10208,235.45,"learning, reinforcement, deep, course, policy, part, algorithms, gym, pytorch, code, open, coding, intro, gradients, machine, right, get, sarsa, double, gradient",20,Beginner,26.67,53.33,20.0,15,https://www.youtube.com/watch?v=ELE2_Mftqoc,2019-05-14T12:19:37Z,freeCodeCamp.org
machine learning advanced,qNxrPri1V0I,Learn Machine Learning Like a GENIUS and Not Waste Time,"Learn Machine Learning Like a GENIUS and Not Waste Time I just started my own Patreon, in case you want to support Patreon Link: You won t learn Machine Learning in 3 months. I don t know how long it will take you but here I am sharing everything I know to get you started and make it as fast as possible. Also Watch: All Machine Learning algorithms explained in 17 min The Math that make Machine Learning easy and how you can learn it 15 Machine Learning Lessons I Wish I Knew Earlier Machine Learni",951701,60483,15.05,"learning, machine, learn, python, playlist, algebra, math, probability, introduction, linear, visuals, calculus, data, started, patreon, know, make, algorithms, course, stats",20,Beginner,66.67,26.67,6.67,15,https://www.youtube.com/watch?v=qNxrPri1V0I,2024-11-14T15:44:06Z,Infinite Codes
