topic,video_id,title,description,views,likes,duration_minutes,keywords,keyword_count,difficulty,positive_comments(%),neutral_comments(%),negative_comments(%),total_comments,video_url,published_at,channel_title
react js beginner,G3e-cpL7ofc,HTML & CSS Full Course Beginner to Pro,"Get a certificate for this course: css or Frontend Bundle React, JS, HTML CSS : bundle Includes certificate of completion and better learning experience smaller videos, ads free Don't worry if you're halfway through or finished the course, you can skip the lessons you finished and take a final test to get a Certificate. Thanks for supporting SuperSimpleDev In this full course, we learn how to build websites with HTML and CSS, and get started as a software engineer. Exercise solutions: css course",16507542,302355,391.4,"css, html, course, get, certificate, bundle, premium, react, supersimpledev, full, basics, frontend, better, learning, experience, videos, finished, lessons, learn, websites",20,Beginner,33.33,66.67,0.0,15,https://www.youtube.com/watch?v=G3e-cpL7ofc,2022-02-05T16:41:52Z,SuperSimpleDev
react js beginner,W6NZfCO5SIk,JavaScript Course for Beginners Your First Step to Web Development,"Learn JavaScript basics with this quick, beginner friendly course Perfect for new coders ready to build real skills and start programming with confidence. Join this channel to get access to perks: V0ZXdmDpPBA/join Ready to dive deeper? Check out my complete JavaScript course: course Subscribe for more coding tutorials: Stay connected: Twitter: Facebook: Instagram: LinkedIn: Why JavaScript? It's the essential language for web development. Build front end AND back end applications with Node.js . S",14398558,246883,48.28,"javascript, tutorial, beginners, course, development, beginner, perfect, ready, build, complete, coding, tutorials, web, end, node, types, functions, learn, basics, quick",20,Beginner,46.67,53.33,0.0,15,https://www.youtube.com/watch?v=W6NZfCO5SIk,2018-04-24T02:37:33Z,Programming with Mosh
react js beginner,qz0aGYrrlhU,HTML Tutorial for Beginners: HTML Crash Course,"Start your web development career with HTML/CSS This beginner friendly tutorial covers the essentials. Join this channel to get access to perks: V0ZXdmDpPBA/join Want to master HTML/CSS? Check out my complete course: course Subscribe for more awesome content: Stay connected: Twitter: Facebook: Instagram: LinkedIn: Why HTML? It's the foundation for every website. Essential skill for front end web developers. Easy to learn, even for absolute beginners. This tutorial is perfect for you if: You drea",10202634,225296,69.57,"web, development, html, career, tutorial, want, course, content, website, works, inspecting, basics, pages, start, beginner, friendly, covers, essentials, join, channel",20,Beginner,40.0,60.0,0.0,15,https://www.youtube.com/watch?v=qz0aGYrrlhU,2021-01-11T14:30:10Z,Programming with Mosh
react js beginner,5-oiLKEWIEw,Best Programming Languages programming coding javascript,,8133702,240314,0.27,No keywords,0,"Here's a classification breakdown:

*   **Best Programming Languages:** Beginner
*   **Programming:** Beginner
*   **Coding:** Beginner
*   **JavaScript:** Intermediate (While JavaScript can be used by beginners, mastering it for front-end, back-end, and more advanced use cases requires intermediate knowledge.)",40.0,46.67,13.33,15,https://www.youtube.com/watch?v=5-oiLKEWIEw,2023-05-01T03:26:26Z,Devslopes
react js beginner,EerdGm-ehJQ,JavaScript Tutorial Full Course Beginner to Pro,"Get a certificate for this course: or Frontend Bundle React, JS, HTML CSS : bundle Includes certificate of completion and better learning experience smaller videos, ads free Don't worry if you're halfway through or finished the course, you can skip the lessons you finished and take a final test to get a Certificate. Thanks for supporting SuperSimpleDev In this JavaScript tutorial and JavaScript full course, learn to build complex websites with JavaScript, HTML, and CSS. Links for each lesson: co",6517136,133288,1335.95,"javascript, css, course, html, certificate, bundle, premium, get, react, supersimpledev, tutorial, intro, functions, project, frontend, better, learning, experience, videos, finished",20,Beginner,60.0,33.33,6.67,15,https://www.youtube.com/watch?v=EerdGm-ehJQ,2024-05-09T07:28:14Z,SuperSimpleDev
react js beginner,Ke90Tje7VS0,React JS React Tutorial for Beginners,Watch the latest version: 2iVquJ3Eaw8X React JS Tutorial Get up & running with React JS: the most popular JavaScript library in the world Want to master React? Get my React mastery course: course Subscribe for more videos like this: Want to learn more from me? Check out my blog and courses: Courses: Blog: Facebook: Twitter: TABLE OF CONTENT 00:00 Introduction 01:14 What is React 05:48 Setting Up the Development Environment 09:27 Your First React App 16:03 Hello World 22:26 Components 24:06 Setti,6345999,93852,145.45,"react, state, components, setting, rendering, updating, passing, phase, get, world, want, course, blog, courses, first, children, handling, events, event, arguments",20,Beginner,33.33,60.0,6.67,15,https://www.youtube.com/watch?v=Ke90Tje7VS0,2018-07-16T16:51:44Z,Programming with Mosh
react js beginner,TlB_eWDSMt4,Node.js Tutorial for Beginners: Learn Node in 1 Hour,"Learn Node.js basics in 1 hour This beginner friendly tutorial gets you coding fast. Join this channel to get access to perks: V0ZXdmDpPBA/join Want to master Node.js? Check out my complete course: course Subscribe for more awesome content: Stay connected: Twitter: Facebook: Instagram: LinkedIn: Why Node.js? Build fast, scalable back end applications with JavaScript. Super in demand for developers Non blocking I/O for high performance. This tutorial is perfect for you if: You know some JavaScrip",6297624,98947,78.27,"module, node, coding, javascript, tutorial, fast, get, want, course, content, system, learn, basics, hour, beginner, friendly, gets, join, channel, access",20,Beginner,26.67,66.67,6.67,15,https://www.youtube.com/watch?v=TlB_eWDSMt4,2018-02-21T23:57:12Z,Programming with Mosh
react js beginner,VlPiVmYuoqw,"JavaScript Tutorial 2024 for Beginners to Pro with Notes, Projects & Practice Questions",Notes available at : link Code for Projects : khapra/JavaScriptSeries New DSA + Development Batch Sigma : batch Join the Apni Community : Time stamp Introduction 00:00:00 Variables and data types 00:01:25 Operators 01:21:18 Loops 02:30:37 Arrays 03:43:30 Functions 04:37:28 DOM part 1 05:39:00 DOM Part 2 06:52:50 Events 07:17:24 Building Game 07:46:41 Classes 08:28:18 Callback 09:22:28 Fetch API 10:37:54 Project Currency converter 11:06:15,5295572,65860,707.23,"batch, dom, part, notes, available, link, code, projects, new, dsa, development, sigma, join, apni, community, time, stamp, introduction, variables, data",20,Beginner,6.67,93.33,0.0,15,https://www.youtube.com/watch?v=VlPiVmYuoqw,2023-12-21T14:39:41Z,Apna College
react js beginner,SqcY0GlETPk,React Tutorial for Beginners,Master React 18 with TypeScript Build amazing front end apps with this beginner friendly tutorial. Join this channel to get access to perks: V0ZXdmDpPBA/join Want the ultimate React deep dive? Check out my full course: course Subscribe for more awesome content: Stay connected: Twitter: Facebook: Instagram: LinkedIn: TABLE OF CONTENT 00:00:00 Course Intro 00:01:55 Prerequisites 00:02:43 What is React? 00:04:57 Setting Up the Development Environment 00:06:24 Creating a React App 00:09:17 Project S,5046824,86760,80.07,"react, course, creating, component, passing, props, content, building, components, rendering, state, via, exercise, master, typescript, build, amazing, front, end, apps",20,Beginner,60.0,40.0,0.0,15,https://www.youtube.com/watch?v=SqcY0GlETPk,2023-03-12T08:00:07Z,Programming with Mosh
react js beginner,QFaFIcGhPoM,ReactJS Tutorial 1 Introduction,Courses Support UPI Support PayPal Github Follow Codevolution + Twitter + Facebook Business codevolution.business@gmail.com React is an open source javascript library for building user interfaces. React is a project created and maintained by Facebook. React has more than a 100 thousand stars on GitHub and a huge community behind it. React has become increasingly popular among developers and is also one of the most sought out skill sets by companies right now. React has a component based architec,4480046,37593,9.57,"react, support, github, facebook, one, right, application, parts, make, complex, courses, upi, paypal, follow, codevolution, twitter, business, open, source, javascript",20,Beginner,53.33,46.67,0.0,15,https://www.youtube.com/watch?v=QFaFIcGhPoM,2018-10-22T10:30:00Z,Codevolution
react js beginner,-mJFZp84TIY,Introduction to React Js + Installation | Complete React Course in Hindi 1,"Complete react course: In this react course, we will see how to use react using projects. React is an amazing library for creating user interfaces This is going to be a project based course full of real world react projects. Make sure to access the playlist here Important : 9lII9agx66oZnT6IyhcMIbUMNMdt All the source code and other material will be uploaded on codewithharry.com as and when available All the links will be provided in the description Check out my English channel here: Click here t",4388650,82362,16.85,"course, python, complete, react, hindi, using, learn, one, video, projects, creating, learning, programming, javascript, website, tutorials, data, facebook, see, use",20,Beginner,53.33,46.67,0.0,15,https://www.youtube.com/watch?v=-mJFZp84TIY,2021-08-13T12:20:25Z,CodeWithHarry
react js beginner,bMknfKXIFA8,React Course Beginner's Tutorial for React JavaScript Library 2022,"Watch the updated version of this course: Learn React by building eight real world projects and solving 140+ coding challenges. You can also follow this course interactively on Scrimba: React is one of the most popular front end JavaScript libraries for building user interfaces. After completing this course, you will be able to build web apps in modern React, using patterns like functional components and hooks. This teacher is Bob Ziroll, Head of Education at Scrimba. Code is available on the Sc",4204650,74186,715.47,"react, project, state, section, props, intro, tenzies, game, course, build, components, practice, setup, quiz, app, meme, scrimba, images, generator, useeffect",20,Beginner,26.67,73.33,0.0,15,https://www.youtube.com/watch?v=bMknfKXIFA8,2022-01-10T14:47:57Z,freeCodeCamp.org
react js beginner,iiADhChRriM,Learn JSON in 10 Minutes,"In this video we will cover everything you need to know about JSON in only 10 minutes. We will cover what JSON is, why JSON is important, what JSON is used for, the syntax of JSON, and multiple examples of JSON. JSON is the most popular data representation format, and is one of the most important, and easiest concepts you can learn in programming. It allows you to create APIs, config files, and structured data. We will be covering all of the terminology, and going through live examples of all th",3551759,100266,12.0,"json, cover, minutes, important, examples, data, learn, programming, video, everything, need, know, used, syntax, multiple, popular, representation, format, one, easiest",20,"**Beginner**

Here's why:

*   **""Learn JSON in 10 minutes""**: This title is clearly aimed at beginners. It promises a quick and easy introduction.
*   **""Cover everything you need to know""**: This suggests a fundamental, high-level overview rather than an in-depth exploration.
*   **""What JSON is, why JSON is important, what JSON is used for, the syntax of JSON, and multiple examples of JSON""**: These are all basic introductory topics suitable for someone new to JSON.
*   **""Most popular data representation format, and is one of the most important, and easiest concepts you can learn in programming""**: This reinforces the idea that it's a fundamental and accessible concept.
*   **""Allows you to create APIs, config files, and structured data""**: This provides context for why a beginner should care about JSON.
*   **""Terminology...live examples of all the different JSON types""**: This indicates an effort to explain basic concepts clearly with practical illustrations.

The mention of APIs and config files might touch on slightly more advanced topics, but the overall tone and content suggest a beginner-level introduction. The fact that it's part of a ""Learn X in Y Minutes"" playlist further solidifies this classification.",86.67,13.33,0.0,15,https://www.youtube.com/watch?v=iiADhChRriM,2018-11-01T20:30:00Z,Web Dev Simplified
react js beginner,0-S5a0eXPoc,React Native Tutorial for Beginners Build a React Native App,Build amazing iOS & Android apps with React Native This beginner friendly tutorial gets you started. Join this channel to get access to perks: V0ZXdmDpPBA/join Ready for a deep dive? Check out my full course: native course Subscribe for more awesome content: Stay connected: Twitter: Facebook: Instagram: LinkedIn: Why React Native? Build apps for both iOS & Android using your web development skills. Faster development than native languages. Huge developer community and resources. This tutorial is,3551564,54461,126.5,"react, native, development, ios, android, tutorial, course, exercises, running, build, apps, get, content, app, platform, layout, debugging, view, image, screen",20,Beginner,26.67,60.0,13.33,15,https://www.youtube.com/watch?v=0-S5a0eXPoc,2020-05-11T16:00:11Z,Programming with Mosh
react js beginner,RGKi6LSPDLU,React Tutorial in Hindi,"Join my Recently launched Complete & Free React Course with 3 Projects: 9lII9agx66oZnT6IyhcMIbUMNMdt ReactJs Complete Course: In this complete react tutorial for beginners in Hindi, we will discuss various aspects of React. We will look into why we use react and how React can be used to build amazing Single page applications with a lot of conveniences. React is a JavaScript library for creating User Interfaces. React uses JavaScript to deliver amazing user experiences when it comes to serving si",3544906,74953,132.95,"complete, react, python, course, hindi, javascript, learn, one, video, using, amazing, single, page, applications, creating, user, learning, programming, website, tutorials",20,Beginner,20.0,80.0,0.0,15,https://www.youtube.com/watch?v=RGKi6LSPDLU,2021-04-14T14:43:19Z,CodeWithHarry
react js beginner,0fYi8SGA20k,Build and Deploy an Amazing 3D Web Developer Portfolio in React JS | Beginner Three.js Tutorial,"The most impressive websites in the world use 3D graphics and animations to bring their content to life. Learn how to build your own ThreeJS 3D Developer Portfolio today Video Kit | Guide, Design, Repository, Readme, and more kit/d8d459a8 d572 44ee b699 41e4df96f443 Hostinger BLACK FRIDAY | Save up to 80% for the Business plan for just $2.95 per month with a 91% off coupon code: JAVASCRIPTMASTERY In this course, you'll learn the following: ThreeJS a powerful 3D graphics library for rendering and",3320540,81215,173.32,"section, graphics, learn, threejs, library, react, popular, jsm, world, animations, bring, life, business, code, website, using, higher, order, follow, contact",20,Beginner,40.0,53.33,6.67,15,https://www.youtube.com/watch?v=0fYi8SGA20k,2023-03-03T11:04:36Z,JavaScript Mastery
react js beginner,eILUmCJhl64,React & Redux Complete Course 2024 with Projects | Notes | Free Certification,"For AI & ML course admission queries, message us or WhatsApp on +91 8000121313 GitHub Code Repo: Coding/React Complete YouTube Our Prime PLACEMENT Courses: AI & ML for Placements: FOR EVERYONE Placement Guidance by Prashant sir: GUIDANCE Complete Coding Bundle: CODING BUNDLE MERN Stack: STACK DSA Course: USING JAVA Completion Certificate REACT AND REDUX Free Notes for all Courses: REACT AND REDUX Complete Coding Platform: Website: Social Media: Linkedin: Github: Coding Whatsapp Updates: Instagra",3280109,56022,1193.62,"react, complete, project, redux, coding, version, course, using, hook, beginner, components, data, state, placement, java, knowledgegate, app, level, whatsapp, github",20,Beginner,26.67,73.33,0.0,15,https://www.youtube.com/watch?v=eILUmCJhl64,2023-11-04T02:25:41Z,Complete Coding by Prashant Sir
react js beginner,DLX62G4lc44,Learn React JS Full Course for Beginners Tutorial 2019,"Watch the updated version of this course: React.js is a JavaScript library for building dynamic web applications. Upon completion of this course, you'll know everything you need in order to build web applications in React. You can also try the interactive version of the course here: This comprehensive introduction to React was created by Bob Ziroll @bobziroll . Bob is the Director of Education at V School, an award winning school of technology education. Tutorial Hell link mentioned in video: my",3157004,45789,305.57,"react, practice, components, todo, app, phase, part, course, props, state, jsx, conditional, rendering, forms, version, javascript, building, web, applications, try",20,Beginner,40.0,53.33,6.67,15,https://www.youtube.com/watch?v=DLX62G4lc44,2018-12-18T16:21:19Z,freeCodeCamp.org
react js beginner,CgkZ7MvWUAA,React Full Course for free 2024,reactjs course tutorial This is a beginners React JS course that should be enough to get you started using the React Library. There are still many more hooks and concepts that are beyond the scope of the beginner level. This video should at least give you a solid foundation. 1. 00:00:00 React tutorial for beginners 2. 00:20:26 card components 3. 00:32:24 add CSS styles 4. 00:40:40 props defaultProps are now deprecated in React 19+ 5. 00:52:49 conditional rendering 6. 01:03:04 render lists 7. 01:,3057787,54350,283.03,"react, hook, app, video, update, state, course, tutorial, beginners, objects, copyright, reactjs, enough, get, started, using, library, still, many, hooks",20,Beginner,26.67,66.67,6.67,15,https://www.youtube.com/watch?v=CgkZ7MvWUAA,2024-01-16T15:55:09Z,Bro Code
react js beginner,QaU6gEtOwyE,Roadmap to Web Development | for Students,shorts,3277999,241912,0.98,No keywords,0,"Without more context, it's hard to give a definitive answer, but generally a ""roadmap to web development"" for students would likely be classified as **Beginner** to **Intermediate**.

Here's why:

*   **Beginner:** A roadmap often starts with the basics like HTML, CSS, and JavaScript. These are fundamental building blocks for web development and are typically covered in introductory courses.
*   **Intermediate:** A roadmap might also include guidance on frameworks (like React, Angular, or Vue), backend technologies, database concepts, and deployment strategies. These topics represent the next step after mastering the basics.
*   **Advanced:** A truly advanced roadmap would delve into topics like complex architectures, performance optimization, security best practices, and emerging technologies. This is less likely to be the focus of content specifically labeled ""for students.""

Since the content is aimed at students, it's more probable that it is geared towards learners who are either new to web development or have some basic knowledge and are looking to expand their skills.

**Therefore, my recommendation is to classify it as Beginner to Intermediate.**",0.0,100.0,0.0,15,https://www.youtube.com/watch?v=QaU6gEtOwyE,2023-10-17T14:20:06Z,Apna College
react js beginner,L0DWAVbdEaM,React Most Asked Interview Question pt1 short shorts javascript react developer interview,Get my Interview notes This video contains the Most asked Reactjs Interview Questions. Join Whatsapp group Subscribe for more upcoming Interview Questions. LIKE | SUBSCRIBE AND SHARE ADD ME ON : Instagram sandip LinkedIn,2504471,111275,0.98,"interview, questions, subscribe, get, notes, video, contains, asked, reactjs, join, whatsapp, group, upcoming, like, share, add, instagram, sandip, linkedin",19,"Based on the keywords provided, I'd classify this as **Beginner to Intermediate**. Here's why:

*   **Beginner:** The emphasis on ""most asked reactjs interview questions"" suggests a focus on fundamental concepts that are often the first things covered in React interviews. Also mentions ReactJS which is generally a beginner term.
*   **Intermediate:** Terms like ""React Developer Interview"" and implied discussion of Javascript suggest some depth beyond the absolute basics and into practical application.

The overall content most likely covers foundational React concepts and common interview questions, which would be most relevant to those with some basic understanding but not necessarily expert-level knowledge.

It is important to note that the tags provide little information about the content, and it may well be more complex than it suggests.",6.67,73.33,20.0,15,https://www.youtube.com/watch?v=L0DWAVbdEaM,2022-07-05T10:40:46Z,Sandip Guchait
react js beginner,hnVOvvbQrwA,Creating our first react app using create react app | Complete React Course in Hindi 2,"Complete react course: In this react course, we will see how to learn React using projects. This is going to be a project based course full of real world react projects. In this video, we will look into creating a new react app using create react app Make sure to access the playlist here Important : 9lII9agx66oZnT6IyhcMIbUMNMdt All the source code and other material will be uploaded on codewithharry.com as and when available All the links will be provided in the description Check out my English ",2310538,44020,21.12,"course, python, react, complete, using, hindi, learn, video, one, projects, creating, app, learning, programming, javascript, website, tutorials, data, facebook, see",20,Advanced,40.0,60.0,0.0,15,https://www.youtube.com/watch?v=hnVOvvbQrwA,2021-08-14T08:29:07Z,CodeWithHarry
react js beginner,gnkrDse9QKc,Beginner React.js Coding Interview ft. Cl ment Mihailescu,I give Cl ment Mihailescu a mock React.js interview that is geared towards beginners. Checkout the video we made on Clem's channel: benawad Cl mentMihailescu react Follow me online: benawad,2277170,47206,36.52,"benawad, give, ment, mihailescu, mock, interview, geared, towards, beginners, checkout, video, made, clem, channel, mentmihailescu, react, follow, online",18,Beginner,40.0,33.33,26.67,15,https://www.youtube.com/watch?v=gnkrDse9QKc,2020-11-20T15:00:13Z,Ben Awad
react js beginner,iEyA1dXZs_M,How to be a backend Developer?,shorts Alpha 4.0 Placement Batch Java+DSA : batch 4 Link for International Students: Fill this form for Free Counselling : Join the Apni Community :,2376645,170227,0.98,"batch, shorts, alpha, placement, link, international, students, fill, form, free, counselling, join, apni, community",14,"This appears to be targeting **Beginner** to **Intermediate** backend developers. Here's why:

*   **""shorts alpha 4.0 placement batch java+dsa""**: This suggests a program designed for those starting their journey towards placement, implying beginner-level understanding. The mention of Java and DSA (Data Structures and Algorithms) also points towards fundamental concepts taught in beginner and intermediate courses.

*   **""placement batch""**: Placement assistance is typically geared towards those relatively new to the job market.

*   **""free counselling""**: Free counselling often targets those needing guidance on career paths or initial skill development, fitting a beginner's profile.

*   **""join the apni community""**: Building a network is especially crucial for beginners.

*   The phrases ""international students fill form free counselling join apni community"" appear to be instructions/calls to action associated with the program, and are not relevant to assessing the difficulty level.

While DSA is important, it's often covered in introductory backend development courses. The overall context suggests a program designed to take individuals from a foundational level to a point where they can secure placements.",20.0,66.67,13.33,15,https://www.youtube.com/watch?v=iEyA1dXZs_M,2023-05-05T17:25:12Z,Apna College
react js beginner,bYIhwrHHo3w,Fast Food App in React Native shorts reactnative expo reactjs app ui,expo reactnative tailwindcss javascript programming typescript speedcode coding design appdevelopment reactjs ui uiux reactnavigation reactnativetutorial react animation reactjs navigation navigationbar uidesign mobiledevelopment iosdeveloper buildinpublic opensource reactnativeapp reactjstutorial typescript fooddeliveryapp uidesign react native animations in react native react native tutorial react native app react native vs flutter react native tutorial for beginners react native project react,2357413,95785,0.4,"react, native, typescript, reactjs, uidesign, tutorial, expo, reactnative, tailwindcss, javascript, programming, speedcode, coding, design, appdevelopment, uiux, reactnavigation, reactnativetutorial, animation, navigation",20,Beginner,46.67,53.33,0.0,15,https://www.youtube.com/watch?v=bYIhwrHHo3w,2023-05-28T10:00:28Z,Code With Nomi
react js beginner,b9eMGE7QtTk,React JS Full Course | Build an App and Master React in 1 Hour,"After building this simple, half hour movie application, imagine what a long and comprehensive 20 hour Next.js course would look like Check it out now jsmastery.pro/next15 JS Mastery Pro A special YOUTUBE discount code is automatically applied Limited time FREE 218 page Ultimate Next.js eBook ebook Materials/References: Ultimate React Roadmap guide JS Mastery PRO Movie App Code 2022 Web Dev Roadmap JavaScript Course: Use the special promo code ""YOUTUBE"" on checkout to save $60 Learning JavaScrip",2055409,43068,71.73,"react, javascript, course, mastery, code, libraries, hour, movie, application, like, pro, special, youtube, time, ultimate, ebook, roadmap, use, step, teach",20,Beginner,46.67,46.67,6.67,15,https://www.youtube.com/watch?v=b9eMGE7QtTk,2022-03-04T11:06:59Z,JavaScript Mastery
